-- Copyright (C) 2026 Intel Corporation
-- SPDX-License-Identifier: PostgreSQL
-- Enable this database and wait for its worker before any index work, so this
-- file runs standalone.  Enrollment reserves the slot synchronously (the gate
-- then passes), but the worker spawns asynchronously; the first INSERT would
-- otherwise race its cold start and time out.  Idempotent and a no-op in the
-- full suite, where vamana_databases.sql (ordered first) has already warmed it.
INSERT INTO vamana_databases (datname, enabled) VALUES (current_database(), true)
	ON CONFLICT (datname) DO NOTHING;
DO $$
BEGIN
	FOR i IN 1 .. 300 LOOP
		PERFORM 1 FROM pg_stat_vamana_worker
			WHERE db_oid = (SELECT oid FROM pg_database WHERE datname = current_database())
			  AND worker_state = 'running';
		EXIT WHEN FOUND;
		PERFORM pg_sleep(0.1);
	END LOOP;
END $$;
SET enable_seqscan = off;
-- Empty-table build: CREATE INDEX on a table with no rows defers the dynamic
-- index to the first INSERT (VamanaWorkerBuildFirstInsert).  Every row entered
-- afterward must be searchable without a rebuild.
CREATE TABLE t (id serial PRIMARY KEY, val vector(3));
CREATE INDEX ON t USING vamana (val vector_l2_ops);
NOTICE:  buffered 0 vectors for SVS index build
NOTICE:  no vectors to index, skipping SVS build
INSERT INTO t (val) VALUES ('[0,0,0]');
INSERT INTO t (val) VALUES ('[1,1,1]'), ('[2,2,2]');
SELECT * FROM t ORDER BY val <-> '[2,2,2]', id LIMIT 3;
 id |   val   
----+---------
  3 | [2,2,2]
  2 | [1,1,1]
  1 | [0,0,0]
(3 rows)

DROP TABLE t;
-- Incremental INSERT: new rows are searchable without REINDEX or rebuild.
-- After CREATE INDEX the cache is warm and dynamic, so INSERT uses SVSAddPoints
-- and the subsequent SELECT finds the new rows without any rebuild NOTICEs.
CREATE TABLE t (id serial PRIMARY KEY, val vector(3));
INSERT INTO t (val) VALUES ('[0,0,0]'), ('[1,1,1]'), ('[2,2,2]');
CREATE INDEX ON t USING vamana (val vector_l2_ops);
NOTICE:  buffered 3 vectors for SVS index build
NOTICE:  building SVS index with 3 vectors of dimension 3
NOTICE:  SVS index built successfully
-- Insert a single row and verify it appears in results (no rebuild expected)
INSERT INTO t (val) VALUES ('[3,3,3]');
SELECT * FROM t ORDER BY val <-> '[3,3,3]', id LIMIT 3;
 id |   val   
----+---------
  4 | [3,3,3]
  3 | [2,2,2]
  2 | [1,1,1]
(3 rows)

-- Insert multiple rows and verify all are searchable
INSERT INTO t (val) VALUES ('[4,4,4]'), ('[5,5,5]');
SELECT * FROM t ORDER BY val <-> '[5,5,5]', id LIMIT 3;
 id |   val   
----+---------
  6 | [5,5,5]
  5 | [4,4,4]
  4 | [3,3,3]
(3 rows)

DROP TABLE t;
-- Incremental INSERT with inner product distance
CREATE TABLE t (id serial PRIMARY KEY, val vector(3));
INSERT INTO t (val) VALUES ('[1,0,0]'), ('[0,1,0]'), ('[0,0,1]');
CREATE INDEX ON t USING vamana (val vector_ip_ops);
NOTICE:  buffered 3 vectors for SVS index build
NOTICE:  building SVS index with 3 vectors of dimension 3
NOTICE:  SVS index built successfully
INSERT INTO t (val) VALUES ('[1,1,1]');
SELECT * FROM t ORDER BY val <#> '[1,1,1]', id LIMIT 2;
 id |   val   
----+---------
  4 | [1,1,1]
  1 | [1,0,0]
(2 rows)

DROP TABLE t;
-- Incremental INSERT with cosine distance
CREATE TABLE t (id serial PRIMARY KEY, val vector(3));
INSERT INTO t (val) VALUES ('[1,0,0]'), ('[0,1,0]'), ('[0,0,1]');
CREATE INDEX ON t USING vamana (val vector_cosine_ops);
NOTICE:  buffered 3 vectors for SVS index build
NOTICE:  building SVS index with 3 vectors of dimension 3
NOTICE:  SVS index built successfully
INSERT INTO t (val) VALUES ('[1,1,0]');
SELECT * FROM t ORDER BY val <=> '[1,1,0]', id LIMIT 2;
 id |   val   
----+---------
  4 | [1,1,0]
  1 | [1,0,0]
(2 rows)

DROP TABLE t;
-- DELETE + VACUUM: deleted rows removed from dynamic index via SVSDeletePoints
CREATE TABLE t (id serial PRIMARY KEY, val vector(3));
INSERT INTO t (val) VALUES ('[0,0,0]'), ('[1,1,1]'), ('[2,2,2]'), ('[3,3,3]'), ('[4,4,4]');
CREATE INDEX ON t USING vamana (val vector_l2_ops);
NOTICE:  buffered 5 vectors for SVS index build
NOTICE:  building SVS index with 5 vectors of dimension 3
NOTICE:  SVS index built successfully
-- Warm the cache with a query
SELECT * FROM t ORDER BY val <-> '[2,2,2]', id LIMIT 1;
 id |   val   
----+---------
  3 | [2,2,2]
(1 row)

-- Delete two rows and vacuum
DELETE FROM t WHERE id IN (2, 4);
VACUUM t;
-- Deleted rows should not appear in results
SELECT * FROM t ORDER BY val <-> '[1,1,1]', id;
 id |   val   
----+---------
  1 | [0,0,0]
  3 | [2,2,2]
  5 | [4,4,4]
(3 rows)

DROP TABLE t;
-- Mixed incremental INSERT + DELETE + VACUUM cycle
CREATE TABLE t (id serial PRIMARY KEY, val vector(3));
INSERT INTO t (val) VALUES ('[0,0,0]'), ('[1,1,1]'), ('[2,2,2]');
CREATE INDEX ON t USING vamana (val vector_l2_ops);
NOTICE:  buffered 3 vectors for SVS index build
NOTICE:  building SVS index with 3 vectors of dimension 3
NOTICE:  SVS index built successfully
-- Incremental insert
INSERT INTO t (val) VALUES ('[3,3,3]'), ('[4,4,4]');
-- Verify new rows present
SELECT * FROM t ORDER BY val <-> '[4,4,4]', id LIMIT 3;
 id |   val   
----+---------
  5 | [4,4,4]
  4 | [3,3,3]
  3 | [2,2,2]
(3 rows)

-- Delete some rows and vacuum
DELETE FROM t WHERE id IN (1, 3);
VACUUM t;
-- Verify only surviving rows returned
SELECT * FROM t ORDER BY val <-> '[2,2,2]', id;
 id |   val   
----+---------
  2 | [1,1,1]
  4 | [3,3,3]
  5 | [4,4,4]
(3 rows)

DROP TABLE t;
-- REINDEX after incremental inserts produces a fresh dynamic index
CREATE TABLE t (id serial PRIMARY KEY, val vector(3));
INSERT INTO t (val) VALUES ('[0,0,0]'), ('[1,1,1]');
CREATE INDEX idx_reindex ON t USING vamana (val vector_l2_ops);
NOTICE:  buffered 2 vectors for SVS index build
NOTICE:  building SVS index with 2 vectors of dimension 3
NOTICE:  SVS index built successfully
INSERT INTO t (val) VALUES ('[2,2,2]'), ('[3,3,3]');
REINDEX INDEX idx_reindex;
NOTICE:  buffered 4 vectors for SVS index build
NOTICE:  building SVS index with 4 vectors of dimension 3
NOTICE:  SVS index built successfully
SELECT * FROM t ORDER BY val <-> '[3,3,3]', id LIMIT 2;
 id |   val   
----+---------
  4 | [3,3,3]
  3 | [2,2,2]
(2 rows)

DROP TABLE t;
-- svs.compact_threshold_pct: compact on every VACUUM with pending deletes
SET svs.compact_threshold_pct = 0;
CREATE TABLE t (id serial PRIMARY KEY, val vector(3));
INSERT INTO t (val) VALUES ('[0,0,0]'), ('[1,1,1]'), ('[2,2,2]'), ('[3,3,3]'), ('[4,4,4]');
CREATE INDEX ON t USING vamana (val vector_l2_ops);
NOTICE:  buffered 5 vectors for SVS index build
NOTICE:  building SVS index with 5 vectors of dimension 3
NOTICE:  SVS index built successfully
SELECT * FROM t ORDER BY val <-> '[2,2,2]', id LIMIT 1;
 id |   val   
----+---------
  3 | [2,2,2]
(1 row)

DELETE FROM t WHERE id = 3;
VACUUM t;
SELECT * FROM t ORDER BY val <-> '[2,2,2]', id LIMIT 3;
 id |   val   
----+---------
  2 | [1,1,1]
  4 | [3,3,3]
  1 | [0,0,0]
(3 rows)

DROP TABLE t;
RESET svs.compact_threshold_pct;
-- svs.compact_threshold_pct: 100 disables compact (consolidate still runs)
SET svs.compact_threshold_pct = 100;
CREATE TABLE t (id serial PRIMARY KEY, val vector(3));
INSERT INTO t (val) VALUES ('[0,0,0]'), ('[1,1,1]'), ('[2,2,2]'), ('[3,3,3]'), ('[4,4,4]');
CREATE INDEX ON t USING vamana (val vector_l2_ops);
NOTICE:  buffered 5 vectors for SVS index build
NOTICE:  building SVS index with 5 vectors of dimension 3
NOTICE:  SVS index built successfully
SELECT * FROM t ORDER BY val <-> '[2,2,2]', id LIMIT 1;
 id |   val   
----+---------
  3 | [2,2,2]
(1 row)

DELETE FROM t WHERE id IN (2, 3, 4);
VACUUM t;
SELECT * FROM t ORDER BY val <-> '[0,0,0]', id;
 id |   val   
----+---------
  1 | [0,0,0]
  5 | [4,4,4]
(2 rows)

DROP TABLE t;
RESET svs.compact_threshold_pct;
-- svs.compact_threshold_pct: out-of-range values rejected
SET svs.compact_threshold_pct = -1;
ERROR:  -1 is outside the valid range for parameter "svs.compact_threshold_pct" (0 .. 100)
SET svs.compact_threshold_pct = 101;
ERROR:  101 is outside the valid range for parameter "svs.compact_threshold_pct" (0 .. 100)
SHOW svs.compact_threshold_pct;
 svs.compact_threshold_pct 
---------------------------
 10
(1 row)

-- -------------------------------------------------------------------------
-- Transactional rollback (undo-on-abort)
-- -------------------------------------------------------------------------
-- INSERT + ROLLBACK: rolled-back vector must not appear in search results.
CREATE TABLE t (id serial PRIMARY KEY, val vector(3));
INSERT INTO t (val) VALUES ('[0,0,0]'), ('[1,1,1]'), ('[2,2,2]');
CREATE INDEX ON t USING vamana (val vector_l2_ops);
NOTICE:  buffered 3 vectors for SVS index build
NOTICE:  building SVS index with 3 vectors of dimension 3
NOTICE:  SVS index built successfully
BEGIN;
INSERT INTO t (val) VALUES ('[9,9,9]');
ROLLBACK;
-- [9,9,9] must not appear; only the original 3 rows
SELECT * FROM t ORDER BY val <-> '[9,9,9]', id LIMIT 3;
 id |   val   
----+---------
  3 | [2,2,2]
  2 | [1,1,1]
  1 | [0,0,0]
(3 rows)

DROP TABLE t;
-- INSERT + COMMIT: committed vector must appear in search results.
CREATE TABLE t (id serial PRIMARY KEY, val vector(3));
INSERT INTO t (val) VALUES ('[0,0,0]'), ('[1,1,1]'), ('[2,2,2]');
CREATE INDEX ON t USING vamana (val vector_l2_ops);
NOTICE:  buffered 3 vectors for SVS index build
NOTICE:  building SVS index with 3 vectors of dimension 3
NOTICE:  SVS index built successfully
BEGIN;
INSERT INTO t (val) VALUES ('[9,9,9]');
COMMIT;
-- [9,9,9] must appear
SELECT * FROM t ORDER BY val <-> '[9,9,9]', id LIMIT 2;
 id |   val   
----+---------
  4 | [9,9,9]
  3 | [2,2,2]
(2 rows)

DROP TABLE t;
-- SAVEPOINT: only the sub-transaction's insert is undone on ROLLBACK TO.
CREATE TABLE t (id serial PRIMARY KEY, val vector(3));
INSERT INTO t (val) VALUES ('[0,0,0]'), ('[1,1,1]'), ('[2,2,2]');
CREATE INDEX ON t USING vamana (val vector_l2_ops);
NOTICE:  buffered 3 vectors for SVS index build
NOTICE:  building SVS index with 3 vectors of dimension 3
NOTICE:  SVS index built successfully
BEGIN;
INSERT INTO t (val) VALUES ('[5,5,5]');
SAVEPOINT sp1;
INSERT INTO t (val) VALUES ('[9,9,9]');
ROLLBACK TO sp1;
COMMIT;
-- [5,5,5] must appear, [9,9,9] must not
SELECT * FROM t ORDER BY val <-> '[9,9,9]', id LIMIT 3;
 id |   val   
----+---------
  4 | [5,5,5]
  3 | [2,2,2]
  2 | [1,1,1]
(3 rows)

DROP TABLE t;
-- Nested SAVEPOINT: releasing an inner savepoint into its parent, then
-- rolling back that parent, must undo the inner savepoint's insert too.
-- svs.search_window_size overrides the index's search_window_size reloption,
-- so it must be set here to actually cap the candidate window at 10: with a
-- leaked graph entry, the closest 10 of 11 candidates displace the farthest
-- real row, and that row's heap tuple was never invisible, so it should have
-- been visible; losing it drops the visible result count below 10.
CREATE TABLE t (id serial PRIMARY KEY, val vector(3));
INSERT INTO t (val) SELECT ARRAY[i, i, i]::vector(3) FROM generate_series(1, 10) AS i;
CREATE INDEX ON t USING vamana (val vector_l2_ops) WITH (search_window_size = 10);
NOTICE:  buffered 10 vectors for SVS index build
NOTICE:  building SVS index with 10 vectors of dimension 3
NOTICE:  SVS index built successfully
BEGIN;
SAVEPOINT outer_sp;
SAVEPOINT inner_sp;
INSERT INTO t (val) VALUES ('[0,0,0]');
RELEASE SAVEPOINT inner_sp;
ROLLBACK TO SAVEPOINT outer_sp;
COMMIT;
SET svs.search_window_size = 10;
SELECT count(*) FROM (SELECT id FROM t ORDER BY val <-> '[0,0,0]' LIMIT 10) sub;
 count 
-------
    10
(1 row)

RESET svs.search_window_size;
DROP TABLE t;
-- -------------------------------------------------------------------------
-- Test A: Large DELETE batch (>1000 rows) exercises VAMANA_MAX_DELETE_IDS
-- batching loop in vamanabulkdelete.
-- -------------------------------------------------------------------------
CREATE TABLE t_large (id serial PRIMARY KEY, val vector(3));
INSERT INTO t_large (val) SELECT ARRAY[random(), random(), random()]::vector(3)
    FROM generate_series(1, 1500);
CREATE INDEX ON t_large USING vamana (val vector_l2_ops);
NOTICE:  buffered 1500 vectors for SVS index build
NOTICE:  building SVS index with 1500 vectors of dimension 3
NOTICE:  SVS index built successfully
-- Warm the cache
SELECT count(*) FROM (SELECT * FROM t_large ORDER BY val <-> '[0.5,0.5,0.5]' LIMIT 1) sub;
 count 
-------
     1
(1 row)

-- Delete more than 1000 rows to force multiple batches
DELETE FROM t_large WHERE id <= 1200;
VACUUM t_large;
-- Only 300 rows should remain
SELECT count(*) FROM (SELECT * FROM t_large ORDER BY val <-> '[0.5,0.5,0.5]' LIMIT 1500) sub;
 count 
-------
   100
(1 row)

DROP TABLE t_large;
-- -------------------------------------------------------------------------
-- Test B: Large ROLLBACK (>1000 inserts) exercises batched undo path.
-- -------------------------------------------------------------------------
CREATE TABLE t_undo (id serial PRIMARY KEY, val vector(3));
INSERT INTO t_undo (val) VALUES ('[0,0,0]'), ('[1,1,1]'), ('[2,2,2]');
CREATE INDEX ON t_undo USING vamana (val vector_l2_ops);
NOTICE:  buffered 3 vectors for SVS index build
NOTICE:  building SVS index with 3 vectors of dimension 3
NOTICE:  SVS index built successfully
BEGIN;
INSERT INTO t_undo (val) SELECT ARRAY[random(), random(), random()]::vector(3)
    FROM generate_series(1, 1500);
ROLLBACK;
-- Only the original 3 rows should be searchable
SELECT count(*) FROM (SELECT * FROM t_undo ORDER BY val <-> '[0,0,0]' LIMIT 2000) sub;
 count 
-------
     3
(1 row)

DROP TABLE t_undo;
-- -------------------------------------------------------------------------
-- Test C: ROLLBACK TO SAVEPOINT skips the consolidate a full abort runs, so a
-- deleted entry point goes unrepaired. Insert a large batch inside the
-- savepoint to raise the odds one of them is the entry point.
-- -------------------------------------------------------------------------
CREATE TABLE t (id serial PRIMARY KEY, val vector(3));
INSERT INTO t (val) SELECT ARRAY[random(), random(), random()]::vector(3)
	FROM generate_series(1, 30);
CREATE INDEX ON t USING vamana (val vector_l2_ops);
NOTICE:  buffered 30 vectors for SVS index build
NOTICE:  building SVS index with 30 vectors of dimension 3
NOTICE:  SVS index built successfully
BEGIN;
SAVEPOINT sp_entry;
INSERT INTO t (val) SELECT ARRAY[random(), random(), random()]::vector(3)
	FROM generate_series(1, 200);
ROLLBACK TO SAVEPOINT sp_entry;
COMMIT;
-- Reports a fixed NOTICE instead of the search's own (library-internal) error text.
DO $$
DECLARE
	probe vector(3);
BEGIN
	FOR probe IN
		SELECT * FROM (VALUES
			('[0,0,0]'::vector(3)), ('[1,1,1]'::vector(3)), ('[1,0,0]'::vector(3)),
			('[0,1,0]'::vector(3)), ('[0,0,1]'::vector(3))
		) AS probes (v)
	LOOP
		BEGIN
			PERFORM id FROM t ORDER BY val <-> probe LIMIT 5;
			RAISE NOTICE 'search after ROLLBACK TO SAVEPOINT: succeeded';
		EXCEPTION WHEN OTHERS THEN
			RAISE NOTICE 'search after ROLLBACK TO SAVEPOINT: raised an error';
		END;
	END LOOP;
END $$;
NOTICE:  search after ROLLBACK TO SAVEPOINT: succeeded
NOTICE:  search after ROLLBACK TO SAVEPOINT: succeeded
NOTICE:  search after ROLLBACK TO SAVEPOINT: succeeded
NOTICE:  search after ROLLBACK TO SAVEPOINT: succeeded
NOTICE:  search after ROLLBACK TO SAVEPOINT: succeeded
-- A crash caused by the above is this file's own problem to clean up after,
-- so later files sharing this server don't inherit a worker mid-restart.
DO $$
BEGIN
	FOR i IN 1 .. 300 LOOP
		PERFORM 1 FROM pg_stat_vamana_worker
			WHERE db_oid = (SELECT oid FROM pg_database WHERE datname = current_database())
			  AND worker_state = 'running';
		EXIT WHEN FOUND;
		PERFORM pg_sleep(0.1);
	END LOOP;
END $$;
SELECT count(*) FROM (SELECT id FROM t ORDER BY val <-> '[0,0,0]' LIMIT 100) sub;
 count 
-------
    30
(1 row)

DROP TABLE t;
-- -------------------------------------------------------------------------
-- TRUNCATE must not leave stale cache — post-TRUNCATE query returns empty.
-- -------------------------------------------------------------------------
CREATE TABLE t_trunc (id serial PRIMARY KEY, val vector(3));
INSERT INTO t_trunc (val) VALUES ('[1,1,1]'), ('[2,2,2]'), ('[3,3,3]');
CREATE INDEX ON t_trunc USING vamana (val vector_l2_ops);
NOTICE:  buffered 3 vectors for SVS index build
NOTICE:  building SVS index with 3 vectors of dimension 3
NOTICE:  SVS index built successfully
-- Warm the cache
SELECT count(*) FROM (SELECT * FROM t_trunc ORDER BY val <-> '[1,1,1]' LIMIT 10) sub;
 count 
-------
     3
(1 row)

TRUNCATE t_trunc;
NOTICE:  buffered 0 vectors for SVS index build
NOTICE:  no vectors to index, skipping SVS build
-- After TRUNCATE the index is empty; query must return 0 rows.
SELECT count(*) FROM (SELECT * FROM t_trunc ORDER BY val <-> '[1,1,1]' LIMIT 10) sub;
 count 
-------
     0
(1 row)

DROP TABLE t_trunc;
-- -------------------------------------------------------------------------
-- SVSLoadDynamicIndex build-window fallback must match build-time logic.
-- When build_window_size is unset (0) and search_window_size is non-zero,
-- the load path must use graph_degree*2, not search_window_size.
-- -------------------------------------------------------------------------
CREATE TABLE t_loadwin (id serial PRIMARY KEY, val vector(3));
INSERT INTO t_loadwin (val) VALUES ('[1,0,0]'), ('[0,1,0]'), ('[0,0,1]'), ('[1,1,0]'), ('[0,1,1]');
CREATE INDEX ON t_loadwin USING vamana (val vector_l2_ops) WITH (search_window_size = 20);
NOTICE:  buffered 5 vectors for SVS index build
NOTICE:  building SVS index with 5 vectors of dimension 3
NOTICE:  SVS index built successfully
-- Warm cache and verify initial results.
SELECT count(*) FROM (SELECT * FROM t_loadwin ORDER BY val <-> '[1,0,0]' LIMIT 5) sub;
 count 
-------
     5
(1 row)

-- REINDEX forces a cold reload through SVSLoadDynamicIndex.
REINDEX INDEX CONCURRENTLY t_loadwin_val_idx;
NOTICE:  buffered 5 vectors for SVS index build
NOTICE:  building SVS index with 5 vectors of dimension 3
NOTICE:  SVS index built successfully
-- Results must be unchanged after reload.
SELECT count(*) FROM (SELECT * FROM t_loadwin ORDER BY val <-> '[1,0,0]' LIMIT 5) sub;
 count 
-------
     5
(1 row)

DROP TABLE t_loadwin;
-- SDL425: NaN/Inf rejected on incremental INSERT (dynamic/live index path)
CREATE TABLE t (id serial PRIMARY KEY, val vector(3));
INSERT INTO t (val) VALUES ('[0,0,0]'), ('[1,1,1]');
CREATE INDEX ON t USING vamana (val vector_l2_ops);
NOTICE:  buffered 2 vectors for SVS index build
NOTICE:  building SVS index with 2 vectors of dimension 3
NOTICE:  SVS index built successfully
INSERT INTO t (val) VALUES ('[1,NaN,3]');
ERROR:  NaN not allowed in vector
LINE 1: INSERT INTO t (val) VALUES ('[1,NaN,3]');
                                    ^
INSERT INTO t (val) VALUES ('[1,Infinity,3]');
ERROR:  infinite value not allowed in vector
LINE 1: INSERT INTO t (val) VALUES ('[1,Infinity,3]');
                                    ^
INSERT INTO t (val) VALUES ('[1,-Infinity,3]');
ERROR:  infinite value not allowed in vector
LINE 1: INSERT INTO t (val) VALUES ('[1,-Infinity,3]');
                                    ^
-- NULL must still be silently skipped (must not regress)
INSERT INTO t (val) VALUES (NULL);
SELECT COUNT(*) FROM t WHERE val IS NULL;
 count 
-------
     1
(1 row)

DROP TABLE t;
